td_item	classification	project	issue_number	issue_type	text	if_fixed	fixed_commit_hash	introduced_commit_hash
THRIFT-1990|0	Architecture-ObsTech	thrift	1990	comment_1	Ah ha, turns out Ubuntu's thrift package is v 0.8, which is quite outdated and doesn't include exception support.	no	-	-
THRIFT-2555|0	Design-Des	thrift	2555	description	produces which starts to become annoying the larger the gaps between the numbers are.	no	-	-
THRIFT-2561|0	Code-LQualCd 	thrift	2561	description	"When an enumerated type is translated to objective-c, the type is replaced with simply ""int"". This takes away half the use of an enumerated type as a type. For instance, it is both clearer and a more precise translation to see ""PersonID"" as a field type in a method than ""int"". However, the objective-c compiler does not typedef the enum and as a result essentially forgets the type that is declared in the thrift IDL."	no	-	-
THRIFT-2568|0	Design-Des	thrift	2568	description	Enhance the C# TLS-Transport with a paramater to give it a specific certificate handler function. This enables to easely accept untrusted certificates or accept a specific certificate, which can be useful while debuging.	yes	7b11fec0c53b3231a472e008dfbb285d1aac44df	-
THRIFT-2666|0	Design-Des	thrift	2666	comment_0	Replaced {{PYTHONHASHSEED}} by a literal. Any better solution is welcome.	yes	d0bd17e7263cb8f92c21d3e1dad2ee5b5e9f79e5	-
THRIFT-2666|0	Design-Des	thrift	2666	description	The hash function introduced with THRIFT-2621 breaks with Python older than 3.2, because PYTHONHASHSEED has been introduced with 3.2. The proposed solution is to define a constant PYTHONHASHSEED as a workaround, but only if PYTHONHASHSEED is not available.	yes	d0bd17e7263cb8f92c21d3e1dad2ee5b5e9f79e5	-
THRIFT-2758|0	Code-LQualCd 	thrift	2758	description	"Of course I had to make some content changes. The C# patch file is 354 KB, a lot of files are considered completely replaced. The Delphi patch file has ""only"" 282 KB. The ""content"" changes are (1) one indentation alignment in a batch file, and (2) one missing ASF header in a .cs file which I added. Anything else is just TABS, SPACEs and CRs. I'm going to commit that. For the records, here are the patch files."	yes	d5436f5cf7a100d89abb3d125d8f241ca7dc925e	-
THRIFT-2758|0	Code-LQualCd 	thrift	2758	summary	Whitespace fixups	yes	d5436f5cf7a100d89abb3d125d8f241ca7dc925e	-
THRIFT-568|0	Architecture-VioMod	thrift	568	description	When building thrift python libs on ubuntu, it places the files into site-packages instead of dist-utils	no	-	-
THRIFT-617|0	Code-LQualCd 	thrift	617	description	One of my thrift services does special handling upon receiving SIGHUP. This causes spurious exceptions about EINTR to be logged. Attached patch adds EINTR retry logic akin to the C++ implementation to handle this.	no	-	-
