project,issue_number,issue_type,text,classification,if_fixed,fixed_commit_hash
IMPALA,1929,description,"While running the mem leak test with 4 concurrent clients using the release bits an impalad crashed at with the following stack trace. This can happen in case of RIGHT_OUTER, RIGHT_ANTI and FULL_OUTER joins when the hash table of the partition is NULL. The code has a dcheck that the hash_tbl is not null, which we didn't hit because we were using the release bits.",Code-LQualCd,yes,05b800e56703f7c4e94914dcf4bee7f955e8a647
IMPALA,1934,description,"When LDAP authentication is enabled in Impala, impala-shell always prompts for a password when trying to connect to an Impala daemon, which makes it very hard to use impala-shell in a shell script (where to store the password?) Please make impala-shell support reading password from a command line parameter or from a password file, just like what beeline does.",Design-Des,yes,cca964c3c6d6744b65741c8875ada94cad876042
IMPALA,1963,comment_2,"For my current project, I only really need it to handle the Z properly. Anything else (other timezones, full support) would be a bonus. In terms of Tableau/Impala usability - this problem will come up for anyone with a format that doesn't convert automatically, so the more coverage we get the better. However, in terms of release schedules, I would love to have time zones or at least Zulu time working sooner.",Design-Des,yes,b0f7dabab3d5ee059e39c63b1f479cb29929e747
IMPALA,1963,description,"We have several data sources that return dates in ISO-8601 format. Following IMPALA-648, we are closer to having these convertable to timestamp without effort, but time zones are still not supported: Neither format with a time zone specifier will parse even though they are valid based on my understanding of ISO-8601 and For now we have worked around this by converting with substring to cut off the time zone identifier, but I'm not sure which time zone the dates will be interpreted in. If I cut off the Z, will my dates be parsed in server local time? Ideally, we should be able to cast dates with time zone specifiers to timestamps with cast easily.",Code-LQualCd,yes,3a962e46c5b31dbbcfe4029fdd17c50e09a4d4df
IMPALA,2068,description,"It is currently difficult for clients connected via load balancers to know which coordinator they're connected to. The TOpenSessionResp has a map of configuration settings which are returned, and we can return the connected coordinator in that map. Clients such as Hue can use that information to find the coordinator and thus the debug web UI pages for submitted queries over that session.",Design-Des,yes,938158e1c3a5400dda8a65ee75c4969bdcdaf0b5
IMPALA,2076,description,"*Problem Statement* The ExecSummary does not report the time spent on the network. The time reported on the EXCHANGE node is misleading and does not count network time. This makes it impossible to identify the performance bottleneck. *Cause* The ExecSummary reports the non-waiting time spent in the EXCHANGE as the network time. Obviously, the active time spent in the EXCHANGE is zero (or close to zero). It should be replaced by the corresponding Data Stream Sender total time instead. *Workaround* Examine the corresponding time in the Data Stream Sender instead.",Design-Des,yes,4f18c701ba146130d82cae36455977d7ea4c57d0
IMPALA,2244,description,"This function now loops through each scan range and when there are many, is noticeably slow. For example, an EXPLAIN on a query against 1M blocks and 1000K partitions went from around 450 ms to 700 ms with this change.",Code-SlAlg,yes,750786fee262e5c013026243e07bf4dbab17671c
IMPALA,2244,summary,HdfsScanNode.java computeNumNodes() can be slow,Code-SlAlg,yes,750786fee262e5c013026243e07bf4dbab17671c
IMPALA,2295,description,doesn't deep copy collections. This leaves the destination Tuple with pointers into potentially invalid memory.,Design-Des,yes,235a8d08da9fbc1aaa170c952c87f078623cc506
IMPALA,231,comment_0,We have to mark local var using "DeleteLocalRef" when the local var is done. This will help reduce mem pressure.,Code-LQualCd,yes,7aadac236de0cdd7e8fb88d1dcc2adad2662caec
IMPALA,231,description,"Impala's HBase scan is very slow. For scanning 40000 rows from an colocated HBase table, it took ~5.7sec. The query is: select count(*) from (select * from hbasetbl limit 40000); Majority of the time is spent inside I've done some experiment to figure out where we spent the time by adding a few more timers. Here's the runtime profile: HBASE_SCAN_NODE (id=0):(5s714ms 99.98%) - BytesRead: 4.26 MB - 483.594us - 5s710ms - MemoryUsed: 0.00 - MyOwnTimer1: 1s387ms <-- We should trim this time. - MyOwnTimer2: 2s798ms <-- - MyOwnTimer3: 688.179ms - MyOwnTimer4: 0ns - MyOwnTimer5: 0ns - NumDisksAccessed: 0 - 5.14 MB/sec - RowsReturned: 40.00K (40000) - RowsReturnedRate: 7.00 K/sec - ScanRangesComplete: 0 - 0 - 0ns - 0ns - 0ns - 0ns - 0 - 827.604ms <-- we spent only 800ms on fetching from HBase - 775.05 KB/sec I've attached the code with more timers in the attached file When I increase the limit to 80000, the perf is much worse. Here's the profile: HBASE_SCAN_NODE (id=0):(23s027ms 99.99%) - BytesRead: 8.51 MB - 249.40us - 23s018ms - MemoryUsed: 0.00 - MyOwnTimer1: 5s680ms - MyOwnTimer2: 11s401ms - MyOwnTimer3: 2s829ms - MyOwnTimer4: 0ns - MyOwnTimer5: 0ns - NumDisksAccessed: 0 - 2.76 MB/sec - RowsReturned: 80.00K (80000) - RowsReturnedRate: 3.47 K/sec - ScanRangesComplete: 0 - 0 - 0ns - 0ns - 0ns - 0ns - 0 - 3s085ms - 376.52 KB/sec I didn't see any disk activity. So, I dont' think HBase is going to disk. Also, the read time is only 3sec. The big chuck of time is spent within the block of MyOwnTimer1 and MyOwnTimer2. We spent 5x more time there even though we only scan 2x more rows.",Code-SlAlg,yes,7aadac236de0cdd7e8fb88d1dcc2adad2662caec
IMPALA,231,summary,Impala HBase scan is very slow,Code-SlAlg,yes,7aadac236de0cdd7e8fb88d1dcc2adad2662caec
IMPALA,2341,description,"Ideally, we should make this query work. Alternatively, the error message should be improved. Stack:",Code-LQualCd,yes,84e2c043a4a7c0bbf52bd0786924e2dd86d7c17e
IMPALA,2435,description,"While I was reviewing Dimitris's IMPALA-2369 patch, I realized that in AddBatch() we call Run::Init() without checking the return status of it. That means that Dimitris's patch probably won't do much good :) At Instead of creating a different patch, I will let Dimitris add it to his IMPALA-2369 patch.",Design-Des,yes,7d338af63806fc59b7c3c8edf14a1e60940c7c0c
IMPALA,2457,description,"According to the math behind the PERCENT_RANK() value, a row group containing a single row yields a division by zero error and therefore Impala returns NaN in this case. In this example, there is only 1 'Reptile' row and that line in the result set has a NaN: Most RDBMS examples on the web use data with multiple rows per group, so they don't illustrate what's supposed to happen in this case. But I suspect the right return value in this case might be zero. Cf. ""The first row in any set has a PERCENT_RANK of 0."" That statement suggests the first row (and any tied rows I presume) could be special-cased and no calculation performed. Cf. The analytic example doesn't show all of the relevant output, but there are two DEPARTMENT_IDs in the output that have only one relevant row, and in both those cases the PERCENT_RANK result is shown as 0. I didn't find any PERCENT_RANK() in MySQL to try. I don't have a PostgreSQL instance handy.",Code-LQualCd,yes,f06497e1d61d32b9fffd99a580f56e9a14be3f40
IMPALA,2632,description,"Currently impalad needs external LLVM IR files to be compiled separately from the binary and distributed with the binary. This slows down builds, make it easy for the code to get out of sync in dev environments, and complicates distribution. Instead, we could simply link the IR data into the binary file, so impalad is more self-contained. These IR files are also loaded from disk by codegen for each fragment. Linking the IR into the binary would avoid this step, saving some overhead. Could also address IMPALA-799 (.bc file extension instead of .ll extension) at same time.",Design-Des,yes,47f7f687b9d7090e2222af4b67d9875c9e26ddde
IMPALA,2642,description,"I just noticed this while reading the statestore code: {{OfferUpdate()}} takes if the update queue is full, but in one place that lock has already been taken by the caller: It's not as scary as it sounds, because if the update queue has > 10000 entries there's something wrong anyway, but we should fix this.",Code-MTCor,yes,f97634fcf9a2e48d307f19595e70bdcee9c1980e
IMPALA,2707,description,"For each input row the aggregation node uses HashTable::Find() followed by HashTable::Insert() if the grouping key isn't already present in the table. Both of these methods probe the hash table to find the same bucket. If we added a FindOrInsert() method to the hash table that returned a modifiable iterator pointing to the bucket, we could save a significant number of hash table probes. There is already a TODO in the code for this, so I'm creating a JIRA to track the issue. This could speed up aggregations with large output size significantly, e.g. TPC-H query 13 (see IMPALA-2470).",Code-SlAlg,yes,42e92abfe017bb074e4bf24b630d646b49e5369e
IMPALA,2707,summary,Add FindOrInsert method to hash table to avoid unnecessary probe in aggregation,Design-Des,yes,42e92abfe017bb074e4bf24b630d646b49e5369e
IMPALA,3017,description,I saw a private build where an impalad appears to get OOM-killed while executing the below tests. I believe what is probably happening is that a bunch of large allocations happen at the same time.,Test-ExpTst,yes,d2e8881065986ae2a74da9d2dd246e7f92393922
IMPALA,3077,description,"Because of a quirk in the runtime filters implementation, we currently have to disable them when a join spills. The only reason this is necessary is that the filters are constructed as part of the hash table build. But there is no reason that we need to construct the filters at that point: we could instead construct the filters when doing initial processing of the build input, at which point we see all build-side input rows regardless of whether they are spilled or not. This might actually perform better since it would move some of the CPU work from the CPU-intensive hash table build to the less CPU-intensive construction of the input stream.",Design-Des,yes,c14a6f11dfa3a3bd66d4868bd6e20f81ba822420
IMPALA,3103,comment_1,The following fix improves serialisation efficiency by 20x (!),Code-SlAlg,yes,0a6954de74eec4cca77d1172cff7f206fbfb2c7e
IMPALA,3103,description,"{{TBloomFilters}} have a 'directory' structure that is a list of individual buckets (buckets are about 64k wide). The total size of the directory can be 1MB or even much more. That leads to a lot of buckets, and very inefficient deserialisation as each bucket has to be allocated on the heap. Instead, the {{TBloomFilter}} representation should use one contiguous string (like the real {{BloomFilter}} does, so that it can be allocated with a single operation (and deserialized with a single copy).",Code-SlAlg,yes,0a6954de74eec4cca77d1172cff7f206fbfb2c7e
IMPALA,3103,summary,Improve efficiency of BloomFilter Thrift serialisation,Code-SlAlg,yes,0a6954de74eec4cca77d1172cff7f206fbfb2c7e
IMPALA,321,description,In the summary node in the profile the info strings for start / end times are specified with second granularity. It would be nice to have them specify milliseconds.,Design-Des,yes,11decfa48a3578d19b50513c3a1a8daae7721ae4
IMPALA,322,description,"It would be nice to get able to get information about errors the query encountered, like corruptions, missing block metadata, integer overflows, and anything you guys think would be interesting, in the profile so it's all centralized.",Design-Des,yes,d730071dde3193dfacbeb351b8f406e4a632e8dd
IMPALA,3276,description,PrepareForRead() allows callers to use it in two different modes. In one of the modes it does not report pin failures. The code was written assuming that it will have reservations. This can result it hitting a DCHECK or going down some strange code paths:,Code-LQualCd,yes,36c294b55e64b6b9dd1c0fca30205a05db24b120
IMPALA,330,description,"Web page requests hold for the duration of the callbacks that render the page. This isn't terrible for short-lived requests, but anything that takes a while to render will block other requests. I tried the obvious thing, and Mongoose started behaving very weirdly (rendering the wrong page, rejecting a lot of concurrent requests).",Code-MTCor,yes,1e88e6d0c07e37a30a3100dadbe36e868c530edc
IMPALA,3329,description,"I believe the {{impalad}} log rotation policy is causing logs to rotate out that we don't have access to. {{impalad}} defaults to keeping 10 log files in the log directory. This means if {{impalad}} restarts 11 times, the first logs will be rotated out. Many of the custom cluster tests restart {{impalad}}, though. This means {{impalad}} logs in the custom_cluster logs subdirectory are missing. To prove this is happening as a result of the log rotation policy, and it's not our inability to properly collect logs, I ran locally, and to get timestamps to show more about when tests were being run, I used this: (0) This gets us timestamps when there otherwise wouldn't be any. Here's the time range for our custom cluster tests: The earliest timetstamp log files are for 20:58. Contrast this to the end-to-end tests' log directory, which only has a handful of logs and span the 2 hours it took to run the test. The quick fix is to set the custom cluster tests to run with a limitless log rotation policy. The more detailed fix is to probably plumb things through such that we don't ever rotate logs. This is safe in Jenkins since we deleted the logs directory before every run (in code): we won't have a workspace accumulating logs. (0) Yup, you need {{gawk}} for {{strftime}} which {{mawk}}, the default {{awk}} on at least Ubuntu, doesn't have.",Design-Des,yes,50851f8775070fb0c14a0415a1e41ea71ac1f5a1
IMPALA,3344,description,"The sorter code does not have its internal invariants well-documented and can be tricky to understand when working on it. E.g. what are the valid states for merged versus initial runs, how are end-of-block cases handled. This issue is to clean up the sorter code while documenting important invariants as preparatory work for porting the sorter to the new buffer pool.",Code-LQualCd,yes,37ec25396f2964c386655ce3408b32a73f71edf6
IMPALA,3344,summary,Simplify and document invariants in Sorter,Code-LQualCd,yes,37ec25396f2964c386655ce3408b32a73f71edf6
IMPALA,3548,description,"Currently, the FE generates a number of runtime filters and assigns them to plan nodes without taking the value of RUNTIME_FILTER_MODE into account. In the backend, the filters are removed from the exec nodes based on the target node types (local or remote) and the value of the RUNTIME_FILTER_MODE option. This may cause some confusion to users because they may see runtime filters in the output of explain that aren't applied when the query is executed. This operation should be performed in the FE.",Design-Des,yes,00fd8388c37e1b3207dddf564463b7eeafe3f887
IMPALA,3652,comment_1,"The required fix is for Reset() to take a RowBatch as an argument, to which memory referenced by previously returned rows can be returned. The logic for Reset() attaching memory needs to be similar to the handling of ReachedLimit(), e.g. this example in NLJNode::GetNext():",Design-Des,yes,c28bc3e4f3900bfd0b14084ca19e51b36ea4dca7
IMPALA,3652,description,"There is a tricky corner case in our resource transfer model with subplans and limits. The problem is that the limit in the subplan may mean that the exec node is reset before it has returned its full output. The resource transfer logic generally attaches resources to batches at specific points in the output, e.g. end of partition, end of block, so it's possible that batches returned before the Reset() may reference resources that have not yet been transferred. It's unclear if we test this scenario consistently or if it's always handled correctly. One example is this query, reported in IMPALA-5456:",Design-Des,yes,c28bc3e4f3900bfd0b14084ca19e51b36ea4dca7
IMPALA,3671,description,"The immediate motivation for this is to enable better testing of graceful failures when spilling is disabled (e.g. IMPALA-3670). Currently we only have control over this via startup options, so we have to implement these as custom cluster tests, but there's no reason in principle we need to start a fresh cluster. The idea would be to add a query option 'scratch_limit' or similar, that limits the amount of scratch directory space that can be used. This would be useful to prevent runaway queries or to prevent queries from spilling when that is not desired.",Design-Des,yes,9313dcdb830b0cd24479ca892988d17defc9ca19
THRIFT,1003,description,"attached patch contains following changes: * Added Apache headers to c/h files * Use gtester for running tests. We don't need -wrapper script anymore * Use one-line macros G_DEFINE_TYPE instead of 15-line class definition * Keep formatting closer to glib-like style (one line class definition macroses/remove trailing spaces) Given changes are mostly fixing low hanging fruits. It does not change any logic/api. There are more chages needed, such as * using CLASS_TYPE_new functions instead of * stop using _set_property (aka reflection) in constructors * check more careful about _ref and _unref handling but this requires more careful refactoring so it will be later in a separate patch.",Code-LQualCd,yes,c101092ea742e1252207b6e8f680bf392292c916
THRIFT,1003,summary,Polishing c_glib code,Code-LQualCd,yes,c101092ea742e1252207b6e8f680bf392292c916
THRIFT,1055,description,"resulted in TFramedTransport being improved so it wasn't necessary to disable Nagle. For the case of TServerSocket and TSocket, a simple server case, performance is still very poor, ~30 msg/sec vs. ~11k msg/sec with NoDelay = true. Java and cpp disable nagle in their TSocket and TServerSocket implementations and performance is MUCH improved with nagle disabled for csharp so I'm proposing that csharp should also disable nagle.",Design-Des,yes,2d9dfdb88e58ab5b961726a5506a4f3e0653b807
THRIFT,1065,comment_1,remove some misplaced code (probably copied from another implementation?),Code-DedCd,yes,b3b07d6de4fd673fd8acd1484daa8bf9002d91cc
THRIFT,1065,comment_3,"apparently the java server is not encoding undeclared exceptions ""properly"" (it could be my impl., please see patch), but it works fine on C++ Incoming content: [cpp] Outgoing content: is a [java] Outgoing content: Error:This is a",Design-Des,yes,76d55f635784aa9dfae8ce52ce3eb49ba7f90a40
THRIFT,1065,summary,Unexpected exceptions not proper handled on JS,Code-LQualCd,yes,a8738b5560db8216c06d0a8cea116b7f29255e8e
THRIFT,1100,description,"The python TSSLSocket.py module has TSSLSocket and TSSLServerSocket for outbound and inbound SSL connection wrapping. This ticket is for a patch that makes several improvements: * adds Apache license at top of file * for outbound sockets, SSL certificate validation is now performed by default ** but may be disabled with validate=False in the constructor ** instructs python's ssl library to perform CERT_REQUIRED validation of the certificate ** also checks to make sure the certificate's {{commonName}} matches the hostname we tried to connect to ** raises when the certificate fails validation - tested using google's www.gmail.com (doesnt match) versus mail.google.com (matched cert commonName) ** puts a copy of the peer certificate in self.peercert, regardless of validation status ** sets a public boolean self.is_valid member variable to indicate whether the certificate was validated or not * adds a configurable server certificate file, as a constructor argument {{certfile}} ** allows runtime changing of server cert with setCertfile() on the server, that changes the certfile used in subsequent ssl_wrap() calls ** exposes a class-level variable SSL_PROTOCOL to let the user select ssl.PROTOCOL_TLSv1 or other versions of SSL, instead of hard-coding TLSv1. Defaults to TLSv1 though. * removes unnecessary sys.path modification * adds lots of docstrings In a somewhat unrelated change, this patch changes two lines in TSocket.py where self.handle is compared to None using {{!=}} instead of: {{is not}}.",Code-LQualCd,yes,5040911bfab39b5c9f2a0d715cea0ee9012f7450
THRIFT,1103,comment_2,"Thanks for comitting THRIFT-1094, I'll update the patch this evening (and attach as _v2) to include testing TZlibTransport wrapping in the code (as a cmdline --zlib argument to both scripts). FYI, currently the hudson(jenkins) build seems to be failing on the javascript jslint tasks, stopped the build tests from progressing past the 'test/js' directory...",Test-LacTst,yes,1606659171d9ee8885d5806d6030ec39399b3b08
THRIFT,1103,comment_3,"I updated the test suite to include running every valid combination of server, protocol and wrapping transports (both ssl and zlib). For python2.4, this is 30 combinations and runs in about 24 seconds. For python2.7, there is an extra server type (TProcessPool which uses the multiprocessing module) and the SSL transport (unavailable in py2.4), whichadds up to 66 combinations of tests, running in ~95 seconds. The 4 nested for-loops significantly expands the code test coverage. In addition to everything in the _v1 of this patch, the _v2 version also has: Updated test code: * added testing of TSSLServer, an alternate socket transport * added testing of TZlibTransport, a wrapping transport * added a self-signed cert in with a cautionary .readme to allow testing of the TSSLServerSocket (it needs a certificate file) * fixed -q (quiet) and -v (verbose) options to to lower and raise the verbosity Fixed two problems in and one enhancement: * fixed confusing parameters to both client and server constructors, removing the overly ornate \*args and \*\*kwargs which made the constructor behave poorly when used with just (host,port) as arguments. The constructors better match the TSocket and TServerSocket constructor parameters now. * fixed logic in TSSLServerSocket parameter checking, if validate=True and ca_certs=None, now it raises an exception like the docstring claims it should. * made TSSLServerSocket more robust on failed SSL handshake by closing socket connection and returning None from accept() call, which is better than terminating the entire server in some cases I will attach the _v2 patch in a moment.",Code-LQualCd,yes,1606659171d9ee8885d5806d6030ec39399b3b08
THRIFT,1103,description,"New implementation of zlib compressed transport for python. The attached patch provides a zlib compressed transport wrapper for python. It is similar to the TFramedTransport, in that it wraps another transport, implementing the data compression as a transformation layer on top of the underlying transport that it wraps. The compression level is configurable in the constructor, from 0 (none) to 9 (best) and defaults to 9 for best compression. The way this works is that every write() to the transport appends more data to the internal cStringIO write buffer. When the transport's flush() method is called, the buffered bytes are then passed to a zlib Compressor object and flush()ed with zlib.Z_SYNC_FLUSH. Because the thrift API calls the transport's flush() after writeMessageEnd(), this means very small thrift RPC calls don't get compressed well. This transport works best on thrift protocols where the payload contains strings longer than 10 characters. As with all data compression, the more redundancy in the uncompressed input, the greater the resulting compression. The TZlibTransport class also implements some basic statistics that track the number of raw bytes written and read, versus the decompressed equivalent. The getCompRatio() method returns a tuple of where ratio is computed using: (So 10 compression is 0.10, meaning smaller numbers are better.) The getCompSavings() method returns the actual number of which might be negative when the compression of non-compressible data ends up expanding the data. So hopefully, anyone who uses this transport will be able to tell whether the compression is saving bandwidth or not. I will add the patch in a few minutes. I haven't tested this against the C++ TZlibTransport, only against itself.",Test-LacTst,yes,1606659171d9ee8885d5806d6030ec39399b3b08
THRIFT,1176,description,Below I added the var qualifier on the declare field function. This is fairly trivial and fixes the global scope leak.,Code-LQualCd,yes,5860f8850e049a22e69022697a899958aa00b534
THRIFT,1176,summary,Thrift compiler global leakage js,Code-LQualCd,yes,5860f8850e049a22e69022697a899958aa00b534
THRIFT,1199,description,"For example, in the following union it would be nice to be able to do something like {{boolean test = as an alternative to {{boolean test = ==",Code-LQualCd,yes,63c2d378c53ab7340466495b49451e68a7411c6c
THRIFT,1199,summary,Union structs should have generated methods to test whether a specific field is currently set,Test-LCvg,yes,63c2d378c53ab7340466495b49451e68a7411c6c
THRIFT,1217,comment_1,"I really like to have Windows port within next Thrift release. The suggestion by [David and to use APR on Windows and do minimal changes on the current implementation is a key factor to bring this up and running. However, this patch depends on pthreads for windows and as mentioned on the dev mailing list or within Jira = Is APR feasible for your? Do you really need thet libevent version? Most GNU/Linux distro still provide 1.4.x and I would really like to keep capability to build and use thrift without lot of extra versions of libraries not within a standard distribution.",Architecture-ObsTech,yes,30aae0ca877c9f5863ff881b29edc6a38df9d85a
