project,issue_number,issue_type,text,classification,if_fixed,fixed_commit_hash
HBASE,1655,comment_6,"- Even though TreeMap uses the comparator rather than the equals method to compare keys, using a byte[] as the key seems to break the contract of a java.util.Map. The last paragraph of the [Map says that impls are free to avoid calling equals() but the containsKey(Object key) method should ""return true if and only if this map contains a mapping for a key k such that (key==null ? k==null : key.equals(k))"". As you mentioned, you'd need a byte[] wrapper in order to be compliant. So a byte[] key will work in a TreeMap (and not in a HashMap), but we'd break the Map contract. Seems better to just use String and HashMap which works well and satisfies the Map contract. - Allowing both the static methods and the public construction would bring me back to the complaint I had originally with this class. :) It becomes confusing for a user trying to quickly understand how he/she is supposed to interact with this class. I guess this can all be explained away with documentation, but, it doesn't feel ""good"". - Also, yes, there would be a problem with re-instantiating the static map multiple times, but this could be prevented by implementing a Singleton pattern so that the static access operates on an internal singleton instance with a member Map rather than a static Map. - I agree that there is no reason to construct HBC's for each invocation. An internal HBC instance can be constructed and reused. - Is there a checkstyle.xml file for HBase? That would make it easy to check my code for formatting problems before submitting patches.",Design-Des,yes,6f242ea63f200fe07dd23fc35984e7a9fd7d8215
HBASE,1655,comment_7,".bq So a byte[] key will work in a TreeMap (and not in a HashMap), but we'd break the Map contract. Seems better to just use String and HashMap which works well and satisfies the Map contract. Looking at the TreeMap equals implementation, yes, it breaks the above contract for Map. We're impure (insert lots of sack cloth and ashes, self-flagellation, etc., here -- smile). We are zealous about using byte [] everywhere. As Jon allows above, client-side, we can relax some. IMO, we should not be allowing public construction and static methods. +1 on Singleton to prevent multiple instantiations. There is no checkstyle (maybe there is one up in hadoop). In general 80 characters per line and two spaces for tab. Anything else we'll take. Don't worry about it too much.",Design-Des,yes,6f242ea63f200fe07dd23fc35984e7a9fd7d8215
HBASE,1655,comment_11,"I've submitted another patch, that reflects a different approach taken to improve HTablePool. In the new approach, there will be no static methods at all. Instead, the normal usage of the class will be to instantiate an HTablePool directly and use the getTable and putTable methods to get an HTable and return an HTable to the pool. The pool class will automatically instantiate a new HTable in the case that no HTable for the given table name is in the pool OR if the internal pool for that table name is full (has more elements than its configured max size). The default max size is Integer.MAX_VALUE. While we lose the convenience of calling static methods, we gain a design with less code that is easy to understand, easy to use in an IoC container, and easy to unit test. This patch also includes a small modification to HTable that allows an instantiation to HTable with a null HBaseConfiguration object. This makes it possible to unit test classes such as HTablePool that internally use an HTable without requiring an environment in which the HTable can get and use a connection. Finally, this patch includes modifications to the stargate package reflecting the new HTablePool API. Let me know if this is suitable for inclusion in the project. Thanks to Jon Gray and Stack for their help and input.",Design-Des,yes,6f242ea63f200fe07dd23fc35984e7a9fd7d8215
HBASE,1655,description,"A discussion on the HBase user mailing list led to some suggested improvements for the class. I will be submitting a patch that contains the following changes to HTablePool: * Remove constructors that were not used. * Change access to remaining contstructor from public to private to enforce use of the static factory method getPool. * Change internal map from TreeMap to HashMap because I couldn't see any reason it needed to be sorted. * Remove HBaseConfiguration and tableName member variables since they aren't really properties of the pool itself. They are associated with the HTable that should get instantiated when one is requested from the pool, but not already there.",Code-DedCd,yes,6f242ea63f200fe07dd23fc35984e7a9fd7d8215
HBASE,1655,summary,Usability improvements to HTablePool,Design-Des,yes,6f242ea63f200fe07dd23fc35984e7a9fd7d8215
HBASE,16856,summary,Exception message in SyncRunner.run() should print currentSequence,Design-Des,yes,278625312047a2100f4dbb2d2eaa4e2219d00e14
HBASE,17101,comment_0,"including a rough patch, will cleanup and upload.",Code-LQualCd,yes,680289d67deb42922dd244daa11496a4c8a38f80
HBASE,17101,description,"As described in the doc (see HBASE-15531), we would like to start with user tables for favored nodes. This task ensures FN does not apply to system tables. System tables are in memory and won't benefit from favored nodes. Since we also maintain FN information for user regions in meta, it helps to keep implementation simpler by ignoring system tables for the first iterations.",Design-Des,yes,680289d67deb42922dd244daa11496a4c8a38f80
HBASE,17184,description,Initially I only wanted to fix a badly worded Log message but found a bunch of code convention violations etc. so I decided to clean up the class. It is only whitespace changes with the exception of the one log message (too many).,Code-LQualCd,yes,4a20361f1a235e0365c7923e64d20b28166cfd4b
HBASE,17184,summary,Code cleanup of LruBlockCache,Code-LQualCd,yes,4a20361f1a235e0365c7923e64d20b28166cfd4b
HBASE,17338,comment_3,"In case of on heap MSLAB, all the size calc doing global memstore data size + heap overhead based. That is why was not adding the cell data size in case of on heap. But I think I can do it bit diff way.. So instead of tracking the data size and heap overhead, we will track cell data size and heap size. Pls see it is not heap overhead alone.. This is the total heap space occupied by memstore(s). I can change the calc accordingly. For on heap MSLAB , this heap space count will be the same as what we have before off heap write path work (ie. It will include all cell data size and overhead part). The new accounting ie. cellDataSize will include only the cell data bytes size part. This will be a subset of the former one then. Will do all necessary changes.. This will be a bigger patch then as I will rename all the related area from heapOverhead to heapSize or so. I believe that way will look cleaner. Thoughts? Append/Increment is not adding cells into MSLAB area.. This is to avoid MSLAB wastage. Say same cell is getting incremented 1000 times and cell key+ value size is 100 bytes. If every increment (add to memstore) cell was added to MSLAB, we will overall take ~100KB MSLAB space whereas only 100 bytes is valid at any point.. All the former cells are getting deleted by the addition of a new cell.. The Cell POJO as such is removed from CSLM. But we can not free up that space in MSLAB.. MSLAB is not designed to do this way. That the chunk allocation and offset allocation within a chunk is serially incremented way happening. We can not mark some in btw space as free and reuse.. That will make things very complex for us.. So to avoid these, the simplest way was to NOT use MSLAB for upsert.",Design-Des,yes,ab5970773ad187871270bb63f9a37cead4cf2f6a
HBASE,17338,comment_8,+1 Add more comment on commit to MemstoreSize about diff between heap and data size.... (can be a version of comment that is later in class...) Glad of the simplification. Good stuff @anoop sam john,Code-CpxCd,yes,ab5970773ad187871270bb63f9a37cead4cf2f6a
HBASE,17338,comment_9,Rest is all good. But as discussed internally that isOffheap() addition to MSLAB is better so that we can really avoid adding the dataSize to the MemstoreSize when the memstore is offheap but still the entire Cell is onheap. Now currently we just account for the dataSize also. We can do in another JIRA. +1 otherwise.,Design-Des,yes,ab5970773ad187871270bb63f9a37cead4cf2f6a
HBASE,17338,comment_10,"Thanks for the reviews Stack & Ram.. I have to fix the failed test as those were having assert on heapOverhead size after cell addition to Memstore. Now we track heapSize not overhead. Will add more comments as Stack asked Regarding Ram's comment. I have different opinion. I dont think we need change this way. We track dataSize (irrespective of cell data in on heap or off heap area).. This dataSize been used at Segment level for in memory flush decision, Region level for on disk flushes and globally to force flush some regions. At the 1st 2 levels, it is not doubt that we have to track all the cell data size together. Now the point Ram says is when we have off heap configured and max off heap global size is say 12 GB, once the data size globally reaches this level, we will force flush some regions. So his point is for this tracking, we have to consider only off heap Cells and on heap Cell's data size should not get accounted in the data size but only in the heapSize. (At global level. But at region and segment level it has to get applied). 2 reasons why I am not in favor of this 1. This makes the impl so complex. We need to add isOffheap check down the layers. Also at 2 layers we have to consider these on heap cell data size and one level not. 2. When off heap is enabled, (We have the MSLAB pool off heap in place), we will end up in having on heap Cells when the pool is out of BBs. We will create on demand LABs on heap. If we dont consider those cell's data size at global level, we may reach forced flush level a bit late. That is the only gain. But here the on demand LAB creation is a sign that the write load is so high and delaying the flush will add more pressure to the MSLAB and more and more on demand BBs (2 MB sized) need to get created. One aim of the off heap work is to reduce the max heap space need for the servers. So lets consider the cell data size globally also (how we do now) and make global flushes. Now even if MSLAB is used, the append/increment use cases wont use MSLAB. The cells will be on heap then. But for such a use case, enabling MSLAB (and pool) is totally waste. That is a mis configuration. More and more on demand BB creation, when MSLAB pool is a bad sign. We have a WARN log for just one time as of now.. May be we should repeat this log at certain intervals. (Like for every 100th pool miss or so.) We should be able to turn MSLAB usage ON/OFF per table also. Now this is possible? Am not sure. These 2 things need to be checked and done in another jiras IMO.",Design-Des,yes,ab5970773ad187871270bb63f9a37cead4cf2f6a
HBASE,17338,comment_19,+1 on commit. Lets get up on this new basis. Nice cleanup  (Thanks too for doc edit).,Code-LQualCd,yes,ab5970773ad187871270bb63f9a37cead4cf2f6a
HBASE,17338,description,"We have only data size and heap overhead being tracked globally. Off heap memstore works with off heap backed MSLAB pool. But a cell, when added to memstore, not always getting copied to MSLAB. Append/Increment ops doing an upsert, dont use MSLAB. Also based on the Cell size, we sometimes avoid MSLAB copy. But now we track these cell data size also under the global memstore data size which indicated off heap size in case of off heap memstore. For global checks for flushes (against lower/upper watermark levels), we check this size against max off heap memstore size. We do check heap overhead against global heap memstore size (Defaults to 40% of xmx) But for such cells the data size also should be accounted under the heap overhead.",Design-Des,yes,ab5970773ad187871270bb63f9a37cead4cf2f6a
HBASE,17480,comment_2,+1 That is a nice lump of code removed. You remove Do we have an explicit test of the splitting path any more post this removal?,Code-DedCd,yes,bff7c4f1fda5517c469db7863706140e3c97e9e0
HBASE,17480,description,"HBASE-14551 moves the split region logic to the master-side. With the code in HBASE-14551, the split transaction code from region server side became un-used. There is no need to keep region_server-side split region code. We should remove them to avoid code duplication.",Code-DedCd,yes,bff7c4f1fda5517c469db7863706140e3c97e9e0
HBASE,18085,comment_6,Any chance for a micro benchmark tests Yu? Appreciate ur effort to consider all possible options :-),Test-LacTst,yes,d047cc9ecc7e0067c3b3aaeeb1600da8d774b211
HBASE,18085,comment_9,"Reading the code in I can see it uses a state variable up in the layer in which is declared volatile. So we ourselves using a boolean volatile will be better any way right? Pls check once whether I misread some code path,",Code-LQualCd,yes,d047cc9ecc7e0067c3b3aaeeb1600da8d774b211
HBASE,18085,comment_13,"Sorry, don't quite catch you sir, mind clarify? While writing the JMH case, I felt that using AtomicBoolean or volatile boolean we're actually re-implementing the tryLock logic. And I won't be surprised if JIT has any optimization for its native implementation (smile).",Code-DupCd,yes,d047cc9ecc7e0067c3b3aaeeb1600da8d774b211
HBASE,18085,comment_14,"In ur test method for tryLock, there is no logic other than just try lock and release. If that is been removed as dead code by compiler? One way to avoid that is using the return value. See BlackHole in JMH and its usage.. The diff in numbers that reported by JMH benchmark is so huge! The impl of tryLock is having a volatile read and all. So this huge diff in numbers looks strange no? That was my doubt.",Code-DedCd,yes,d047cc9ecc7e0067c3b3aaeeb1600da8d774b211
HBASE,18085,description,"Parallel purge in ObjectPool is meaningless and will cause contention issue since has synchronization (source code shown below) We observed threads blocking on the purge method while using offheap bucket cache, and we could easily reproduce this by testing the 100% cache hit case in bucket cache with enough reading threads. We propose to add a purgeLock and use tryLock to avoid parallel purge.",Code-MTCor,yes,d047cc9ecc7e0067c3b3aaeeb1600da8d774b211
HBASE,18092,comment_4,"Attaching another patch for master. I found a redundant piece of code related to the patch. The only difference between the previous and this patch is {Code} @@ -528,9 +542,7 @@ public class implements ReplicationListener { */ public void src) { LOG.info(""Done with the recovered queue "" + - if (src instanceof ReplicationSource) { - - } + {Code} Also attaching patches for branch-1 and branch-1.3 as they both have diverged a little bit.",Code-Oth,yes,7b40f4f3ec1cdf278bf416db66284d62c4e078e0
HBASE,18092,comment_13,"Just a nitpick, I think you merged the incorrect patch for master. I was looking at my latest master checkout and see that patch for master that went in is dated May 25, not yesterday. It's not a big deal in this case because the two patches have no functional difference, only that the newer patch got rid of a redundant piece of code.",Code-DedCd,yes,7b40f4f3ec1cdf278bf416db66284d62c4e078e0
HBASE,18092,description,Removing a peer does not clean up the associated metrics and state from walsById map in the,Code-LQualCd,yes,7b40f4f3ec1cdf278bf416db66284d62c4e078e0
HBASE,18092,summary,Removing a peer does not properly clean up the state and metrics,Code-LQualCd,yes,7b40f4f3ec1cdf278bf416db66284d62c4e078e0
HBASE,18180,comment_1,Have a look at TableOutputFormat inside Connection leak problem has already been addressed in this package. Code sample for reference.,Code-LQualCd,yes,ce1ce728c6daee9e294bf2915e91faaa73428f3d
HBASE,18180,summary,Possible connection leak while closing BufferedMutator in TableOutputFormat,Code-LQualCd,yes,ce1ce728c6daee9e294bf2915e91faaa73428f3d
HBASE,18646,comment_1,"If the config is specific to log roll, please reflect this in the name of config.",Code-LQualCd,yes,19bb4ef487407cdf59a3f3c5bbef6dd8b917b682
HBASE,18646,comment_4,Isn't the above default too short for a large cluster ? Please remove commented out code from patch.,Code-DedCd,yes,19bb4ef487407cdf59a3f3c5bbef6dd8b917b682
HBASE,18646,description,The default procedure timeout of 60 sec and pool size (1) may be not optimal for large deployements,Design-Des,yes,19bb4ef487407cdf59a3f3c5bbef6dd8b917b682
HBASE,19073,comment_2,"So the only test passing in QA is But it's weird, this is second time am seeing it failing in a precommit, and the last patch was completely unrelated. It's not even in the flaky list. Let me dig.",Test-FlakyTst,no,
HBASE,19073,description,"- Remove the configuration - Keep following interface since they nicely separate ZK based implementation: ProcedureMemberRpcs - Replace CSM (interface) + BCSM (unnecessary middle hierarchy) with single CSM interface. - Don't pass whole CSM object around (with server in it which gives acess to pretty much everything), only pass the relevant dependencies. Discussion thread on dev@ mailing list.",Design-Des,yes,dd70cc308158c435c6d8ec027e2435a29be4326b
HBASE,19073,summary,Cleanup,Code-LQualCd,yes,dd70cc308158c435c6d8ec027e2435a29be4326b
HBASE,19183,description,Currently the modules hbase-checkstyle and hbase-error-prone define the groupId redundantly. Remove the groupId from these POMs.,Code-LQualCd,yes,d4e3f902e6ba5b747295ca6053f34badd4018175
HBASE,19183,summary,Removed redundant groupId from Maven modules,Code-LQualCd,yes,d4e3f902e6ba5b747295ca6053f34badd4018175
HBASE,19241,comment_5,"+1 after fix the checkstyle warnings. Meanwhile, please add one line change change to trigger hbase-server test. Thanks.",Code-LQualCd,yes,5c312667ed9b9b3bbd870c7fcf26591479da000d
HBASE,19241,comment_6,Fix checkstyle and javadoc warnings. Add one line change in hbase-server module to trigger the UTs.,Code-LQualCd,yes,5c312667ed9b9b3bbd870c7fcf26591479da000d
HBASE,19241,summary,Improve javadoc for AsyncAdmin and cleanup warnings for the implementation classes,Code-LQualCd,yes,5c312667ed9b9b3bbd870c7fcf26591479da000d
HBASE,19373,description,Fix the remaining Checkstyle error regarding line length in the *hbase-annotations* module.,Code-LQualCd,yes,07b193ae4f36345c4073023e0220b3e147c61884
HBASE,19373,summary,Fix Checkstyle error in hbase-annotations,Code-LQualCd,yes,07b193ae4f36345c4073023e0220b3e147c61884
HBASE,19478,description,Currently issues one Get per WAL file: This is rather inefficient considering the number of WAL files in production can get quite large. We should use multi-get to reduce the number of calls to backup table (which normally resides on another server).,Code-SlAlg,yes,cafd4e4ad76f45be912edc9d5021f872de94fd5c
HBASE,19531,summary,Remove needless volatile declaration,Code-LQualCd,yes,9d0c7c6dfbcba0907cbbc2244eac570fcc4d58a5
IMPALA,1013,description,This function is very simple and goes through the HS2 interface to retrieve a few functions. I believe this used to be instantaneously and now takes hundreds of seconds making this likely unusable.,Code-SlAlg,yes,c096d7688102e0570d2461ccc9745abded1b5ae6
IMPALA,1013,summary,is unreasonably slow,Code-SlAlg,yes,c096d7688102e0570d2461ccc9745abded1b5ae6
IMPALA,1022,description,"rows_read < rows_in_file) { We should detect the case where doesn't actually equal the number of rows in the file. If abort_on_error is true, this should fail the query, otherwise we should log something via scan_node_-Such handling did not exist before. Need to decide whether we will read at most as many rows as the metadata or continue reading until there are no more rows in the file. We will need to add tests with parquet files whose metadata is not correct.",Test-LacTst,yes,fe0646f76bf35b525f8f63948a7d3baa481e5bc0
IMPALA,1120,description,"We should update our code that fetches and updates column stats to use the new bulk APIs introduced in Hive .13. Instead of fetching a single column at a time, we can now fetch stats for a list of column names.",Architecture-ObsTech,yes,7542d719c941576d967876a89421dfe0d1e51524
IMPALA,1147,description,The view compatibility tests are disabled and need to be updated to run against Hive .13.,Test-LacTst,yes,2a59029c2cbac2176df424dfcd01f6653b65b955
IMPALA,1147,summary,View compatibility tests need to be updated to run against Hive .13,Test-LacTst,yes,2a59029c2cbac2176df424dfcd01f6653b65b955
IMPALA,1290,description,If an AnalyticEvalNode is the root of a plan tree it should have results ready when Open() returns so that clients do not time out once the query is in a ready state and expect to be able to fetch results. This only happens for unpartitioned analytic evaluation. Should test this in,Test-LacTst,yes,f9b60bce43164d3a3598127ae078bc4f33640720
IMPALA,1414,description,"The following query on a relatively small input takes ~70s with codegen and ~35 minutes without codegen, which seems unreasonably long. We should make sure we're not doing anything crazy in the non-codegen eval path. Executing with codegen: The query profile when running without codegen is attached. I also used perf (linux profiling tool) to collect a profile (sampled stacks) and printed the aggregated callstacks to the attached file The summary without codegen. Most of the time (28mins) is spent in the hash joins:",Code-SlAlg,no,
IMPALA,1414,summary,Slow query without codegen,Code-SlAlg,no,
IMPALA,1430,description,"Currently codegen is disabled for the entire aggregation operator if a single aggregate function can't be codegen'd. We should address this by making it so all aggregate functions can be codegen'd, including UDAs. For UDAs in .so's, the codegen'd function will call into the UDA library. This also affects aggregation operator on timestamp. This perf hit can be especially bad for COMPUTE STATS which is heavily CPU bound on the aggregation and because there is no easy way to exclude the TIMESTAMP columns when computing the column stats (i.e., there is no simple workaround). Even if the portions involving TIMESTAMP cannot be codegen'd it would still be worthwhile to come up with a workaround where codegen for the other types is still enabled. *Workaround* If you are experiencing very slow COMPUTE STATS due to this issue, then you may be able to temporarily ALTER the TIMESTAMP columns to STRING or INT type before running COMPUTE STATS. After the command completed, the columns can be altered back to TIMESTAMP. Note the workaround is only apply to text data, not parquet data. parquet require compatibles data type. TIMESTAMP is INT96, it's not compatible with STRING or BIGINT.",Design-Des,yes,d7246d64c777384f29fe0f824ee0036b58e8aa2d
IMPALA,1596,description,Some the builtin decimal functions assume they can always use the val16 union field of a DecimalType. This isn't actually a valid assumption though. We should only initialize and use the smaller fields (val4/val8) for performance if possible.,Code-LQualCd,yes,31e95e6b440f0317acc8bf3d1ac4d56c8696c376
IMPALA,1598,description,"Some error conditions cause a high volume of output that gets sent to the users, particularly if each backend produces several messages that are aggregated by the coordinator. An example is the Parquet error message when a file spans several blocks: you get one warning per file, all of which are communicating roughly the same thing. Unfortunately we can't just do simple string-matching to de-duplicate the messages, because they're all slightly different (filename changes). We should add an error code to each user-facing message, and use that as the unique key with which to aggregate the messages when there are lots of them.",Design-Des,yes,b582cdc22b757e929016beed795b9a5d4eff6f59
IMPALA,1651,description,"Currently, CREATE TABLE LIKE 'blindly' copies the source table, including the table's and partitions' parameter maps. The parameter maps may contain information about caching directives that do not apply to the new table. I can see two acceptable behaviors (choose one) if the source table is cached: 1. the new table is also cached; we need to issue new caching directives and store them in the params of the new table as appropriate 2. the new table is not cached and must be cached explicitly",Design-Des,yes,aed3505c8d17f759be4f73593f6aa290df384cfa
IMPALA,1691,comment_1,We should get rid of the cached {{Partition}} object inside {{HdfsPartition}}. I'm pretty sure we can reconstruct it from the partition itself when needed (i.e. when sending updates to the HMS).,Design-Des,yes,8c30332237fb6d5a946b80e5fed923e80d064d15
IMPALA,1691,comment_2,I just looked at a catalogd instance with a large table loaded in a profiler. This seems to bear out the idea that the arrays of {{FieldSchema}} in the take a lot of memory. take up about 1.1GB of heap even with a relatively small catalog.,Design-Des,yes,8c30332237fb6d5a946b80e5fed923e80d064d15
IMPALA,1691,description,"It used to be the case that the entire Catalogd's memory usage won't go over 1~2GB. However, a single table with 1000 columns and 8000 partitions used up 1.3GB of memory in the catalogd. The attached script created such a table. To see the memory usage, start catalogd without background loading. Observe the initial memory usage. Then run ""describe"" to load the table and observe the memory usage again.",Design-Des,yes,8c30332237fb6d5a946b80e5fed923e80d064d15
IMPALA,1691,summary,Excessive Memory Usage in Catalogd (without stats),Design-Des,yes,8c30332237fb6d5a946b80e5fed923e80d064d15
